[
  {
    "id": 1,
    "term": "Supervised Learning",
    "definition": "A type of machine learning where the model is trained on labeled data to learn a mapping from inputs to outputs.",
    "tags": ["machine learning", "labeled data", "prediction"],
    "related_terms": ["Classification", "Regression"],
    "examples": ["Predicting house prices using historical sales data."],
    "source": "Scikit-learn documentation",
    "last_updated": "2025-10-23"
  },
  {
    "id": 2,
    "term": "Unsupervised Learning",
    "definition": "A machine learning approach where the model identifies patterns in data without labeled outcomes.",
    "tags": ["clustering", "dimensionality reduction", "pattern discovery"],
    "related_terms": ["Clustering", "Principal Component Analysis"],
    "examples": ["Segmenting customers based on purchasing behavior."],
    "source": "Hastie, Tibshirani & Friedman (2009). The Elements of Statistical Learning.",
    "last_updated": "2025-10-23"
  },
  {
    "id": 3,
    "term": "Classification",
    "definition": "A supervised learning task where the goal is to assign discrete labels to input data.",
    "tags": ["supervised learning", "discrete output", "prediction"],
    "related_terms": ["Logistic Regression", "Decision Tree"],
    "examples": ["Email spam detection, disease diagnosis."],
    "source": "Bishop, C. M. (2006). Pattern Recognition and Machine Learning.",
    "last_updated": "2025-10-23"
  },
  {
    "id": 4,
    "term": "Regression",
    "definition": "A supervised learning task where the goal is to predict continuous numerical values.",
    "tags": ["supervised learning", "continuous output", "prediction"],
    "related_terms": ["Linear Regression", "Polynomial Regression"],
    "examples": ["Predicting temperature based on historical weather data."],
    "source": "James et al. (2013). An Introduction to Statistical Learning.",
    "last_updated": "2025-10-23"
  },
  {
    "id": 5,
    "term": "Clustering",
    "definition": "An unsupervised learning technique that groups data points into clusters based on similarity.",
    "tags": ["unsupervised learning", "grouping", "similarity"],
    "related_terms": ["K-Means", "Hierarchical Clustering"],
    "examples": ["Grouping news articles by topic."],
    "source": "Jain, A. K. (2010). Data clustering: 50 years beyond K-means.",
    "last_updated": "2025-10-23"
  },
  {
    "id": 6,
    "term": "Data Cleaning",
    "definition": "The process of detecting and correcting (or removing) corrupt or inaccurate records from a dataset to improve data quality.",
    "tags": ["data preprocessing", "quality assurance", "missing values"],
    "related_terms": ["Outlier Detection", "Missing Value Imputation"],
    "examples": ["Removing duplicate rows, handling missing values, correcting typos in categorical data."],
    "source": "Kelleher, J.D., Namee, B., & D'Arcy, A. (2015). Fundamentals of Machine Learning for Predictive Data Analytics.",
    "last_updated": "2025-10-23"
  },
  {
    "id": 7,
    "term": "Feature Scaling",
    "definition": "A technique used to normalize the range of independent variables or features of data to ensure uniformity and improve model performance.",
    "tags": ["normalization", "standardization", "preprocessing"],
    "related_terms": ["Min-Max Scaling", "StandardScaler"],
    "examples": ["Scaling features to a range of [0,1] using Min-Max normalization."],
    "source": "Géron, A. (2019). Hands-On Machine Learning with Scikit-Learn, Keras, and TensorFlow.",
    "last_updated": "2025-10-23"
  },
  {
    "id": 8,
    "term": "Dimensionality Reduction",
    "definition": "The process of reducing the number of input variables in a dataset to simplify models and reduce computational cost.",
    "tags": ["feature engineering", "PCA", "data compression"],
    "related_terms": ["Principal Component Analysis", "t-SNE"],
    "examples": ["Using PCA to reduce a dataset from 100 features to 10 principal components."],
    "source": "Jolliffe, I.T., & Cadima, J. (2016). Principal component analysis: a review and recent developments.",
    "last_updated": "2025-10-23"
  },
  {
    "id": 9,
    "term": "Encoding Categorical Variables",
    "definition": "The process of converting categorical data into numerical format so that it can be used in machine learning models.",
    "tags": ["categorical data", "preprocessing", "encoding"],
    "related_terms": ["One-Hot Encoding", "Label Encoding"],
    "examples": ["Transforming 'Color' feature with values ['Red', 'Blue', 'Green'] into one-hot encoded vectors."],
    "source": "Pedregosa et al. (2011). Scikit-learn: Machine Learning in Python.",
    "last_updated": "2025-10-23"
  },
  {
    "id": 10,
    "term": "Feature Extraction",
    "definition": "The process of transforming raw data into informative features that can be used for model training.",
    "tags": ["feature engineering", "preprocessing", "transformation"],
    "related_terms": ["Feature Selection", "Dimensionality Reduction"],
    "examples": ["Extracting edge features from images using Sobel filters."],
    "source": "Guyon, I., & Elisseeff, A. (2003). An introduction to variable and feature selection.",
    "last_updated": "2025-10-23"
  },
  {
    "id": 11,
    "term": "Cross-Validation",
    "definition": "A model evaluation technique that partitions the dataset into multiple subsets, training the model on some and validating it on others to assess generalization performance.",
    "tags": ["model evaluation", "validation", "resampling"],
    "related_terms": ["Train-Test Split", "K-Fold Cross-Validation"],
    "examples": ["Using 5-fold cross-validation to evaluate a classifier's accuracy across different data splits."],
    "source": "Kohavi, R. (1995). A study of cross-validation and bootstrap for accuracy estimation and model selection.",
    "last_updated": "2025-10-23"
  },
  {
    "id": 12,
    "term": "Confusion Matrix",
    "definition": "A table used to describe the performance of a classification model by showing the counts of true positives, false positives, true negatives, and false negatives.",
    "tags": ["classification", "evaluation", "metrics"],
    "related_terms": ["Precision", "Recall", "F1 Score"],
    "examples": ["A binary classifier predicting spam emails yields a confusion matrix with 80 true positives, 10 false positives, 5 false negatives, and 105 true negatives."],
    "source": "Powers, D.M.W. (2011). Evaluation: From precision, recall and F-measure to ROC, informedness, markedness and correlation.",
    "last_updated": "2025-10-23"
  },
  {
    "id": 13,
    "term": "Precision",
    "definition": "The ratio of true positive predictions to the total number of positive predictions made by the model, indicating the accuracy of positive predictions.",
    "tags": ["classification", "metrics", "evaluation"],
    "related_terms": ["Recall","F1 Score", "Confusion Matrix"],
    "examples": ["If a model predicts 100 positive cases and 80 of them are correct, the precision is 0.80."],
    "source": "Sokolova, M., & Lapalme, G. (2009). A systematic analysis of performance measures for classification tasks.",
    "last_updated": "2025-10-23"
  },
  {
    "id": 14,
    "term": "Recall",
    "definition": "The ratio of true positive predictions to the total number of actual positive instances, measuring the model's ability to identify positive cases.",
    "tags": ["classification", "metrics", "evaluation"],
    "related_terms": ["Precision", "F1 Score", "Confusion Matrix"],
    "examples": ["If there are 100 actual positive cases and the model correctly identifies 80, the recall is 0.80."],
    "source": "Sokolova, M., & Lapalme, G. (2009). A systematic analysis of performance measures for classification tasks.",
    "last_updated": "2025-10-23"
  },
  {
    "id": 15,
    "term": "F1 Score",
    "definition": "The harmonic mean of precision and recall, providing a single metric that balances both concerns in classification tasks.",
    "tags": ["classification", "metrics", "evaluation"],
    "related_terms": ["Precision", "Recall", "Confusion Matrix"],
    "examples": ["If a model has precision 0.80 and recall 0.70, the F1 score is approximately 0.746."],
    "source": "Powers, D.M.W. (2011). Evaluation: From precision, recall and F-measure to ROC, informedness, markedness and correlation.",
    "last_updated": "2025-10-23"
  },
  {
    "id": 16,
    "term": "Hyperparameter Tuning",
    "definition": "The process of optimizing the configuration parameters that are not learned during training but affect model performance.",
    "tags": ["optimization", "model tuning", "hyperparameters"],
    "related_terms": ["Grid Search", "Random Search", "Bayesian Optimization"],
    "examples": ["Adjusting the learning rate and number of layers in a neural network to improve accuracy."],
    "source": "Bergstra, J., & Bengio, Y. (2012). Random search for hyper-parameter optimization. Journal of Machine Learning Research.",
    "last_updated": "2025-10-23"
  },
  {
    "id": 17,
    "term": "Grid Search",
    "definition": "An exhaustive search method that evaluates all possible combinations of hyperparameter values in a specified grid.",
    "tags": ["hyperparameter tuning", "grid search", "model selection"],
    "related_terms": ["Random Search", "Cross-Validation"],
    "examples": ["Testing combinations of kernel types and regularization parameters in an SVM."],
    "source": "Pedregosa et al. (2011). Scikit-learn: Machine Learning in Python.",
    "last_updated": "2025-10-23"
  },
  {
    "id": 18,
    "term": "Random Search",
    "definition": "A hyperparameter optimization technique that samples random combinations of parameters from a predefined distribution.",
    "tags": ["hyperparameter tuning", "random sampling", "optimization"],
    "related_terms": ["Grid Search", "Bayesian Optimization"],